{
  "format": "stack.target_version.v0.2",
  "version": "2.1.0",
  "ratified_at": "2026-07-11T00:00:00+02:00",
  "ratified_by": [
    "ADR 0032 (web shell: Dioxus 0.7.9)",
    "ADR 0033 (layer model: domain prefixes + deployment classes)",
    "ADR 0028 (workspace/identity ownership, amended)",
    "ADR 0029 (AI Practices/Sessions boundary, with acceptance addendum)",
    "architecture-alignment-2026-07 arbitration DA-1..DA-12",
    "ADR 0037 (Libre IA Design System 2.0 stack-wide visual contract)",
    "ADR 0038",
    "ADR 0039",
    "ADR 0040",
    "ADR 0041",
    "ADR 0042",
    "ADR 0043",
    "ADR 0044"
  ],
  "layers": [
    {
      "prefix": "product",
      "role": "products",
      "definition": "User-facing workflows under functional libre-ai slugs; owns UX, product state, domain models and publication gates.",
      "deployment_classes": [
        "product-linkable"
      ]
    },
    {
      "prefix": "portal",
      "role": "client platform / design substrate",
      "definition": "Tokens, UI primitives, accessibility, i18n UI, native bindings; also the agents' UI-production capability (tokens-only rule). Never owns actor/tenant authorization.",
      "deployment_classes": [
        "product-linkable",
        "build-time"
      ]
    },
    {
      "prefix": "bolt",
      "role": "factory",
      "definition": "Agent orchestration, planning, handoff evaluation, execution coordination, and the factory's own public proof surfaces. Never ships in product binaries.",
      "deployment_classes": [
        "factory-only"
      ]
    },
    {
      "prefix": "wrench",
      "role": "transverse factory tools",
      "definition": "Inspection, security audit, and stack-evaluation tooling serving two or more domains. Never ships in product binaries.",
      "deployment_classes": [
        "factory-only",
        "build-time"
      ]
    },
    {
      "prefix": "gear",
      "role": "runtime substrate",
      "definition": "Shared services and contracts linkable in product binaries (ingestion, memory, artifacts, distribution). One contract, two clients: product runtimes and agents.",
      "deployment_classes": [
        "product-linkable",
        "factory-only",
        "build-time"
      ]
    }
  ],
  "web_shell": {
    "framework": "dioxus",
    "framework_version": "0.7.9",
    "evidence": "libre-ai/wrench/labs/dioxus ADR 0001 (2026-07-03): wasm 386 KiB gzip vs 450 budget, e2e 22 specs x 4 engines, HttpOnly session proven, a11y/token gates green",
    "adr": "ADR 0032"
  },
  "component_library": {
    "name": "dioxus-primitives (Dioxus Components)",
    "source": "git: DioxusLabs/components rev bf007c15d0cf4d04d3181cc46cf12325aa773955",
    "styling": "headless/unstyled, WAI-ARIA; all appearance via Portal tokens (tokens-only)",
    "license": "MIT OR Apache-2.0",
    "crates_io_follow_up": "un-pin to a semver range when a real (non-0.0.0) release exists on crates.io (lab friction F-006)",
    "adr": "ADR 0036"
  },
  "design_system": {
    "name": "Libre IA Design System",
    "version": "2.0.0",
    "source": "urn:libre-ai:design-system:2.0.0#design-system/tokens/tokens.json",
    "compiler": "libre-ai/portal/forge",
    "palette": "black, white, neutral grays and Vert Libre #22C55E as the only accent",
    "typography": "self-hosted Inter and Plus Jakarta Sans",
    "distribution": "generated CSS, Swift and Kotlin with SHA-256 manifest; no runtime network fetch",
    "exceptions": "raw benchmark evidence stays immutable; CLI-only repositories have no visual surface",
    "adr": "ADR 0037"
  },
  "native_delivery": "Dioxus-first Android/iOS WebView shells with direct native API access; Portal owns adaptive UI and native integration contracts; SwiftUI/Compose remain escape hatches until separately justified",
  "desktop": "Dioxus desktop is the preferred shell, experimental per OS until Wrench proves WebView availability, sandboxing, install/update/rollback, accessibility and size budgets",
  "static_publication": "Dioxus SSG for ecosystem products (ADR 0032 s3); Astro remains permitted tooling outside ecosystem products",
  "session_runtime_owner": "libre-ai/sessions (ADR 0029, canonical slug)",
  "identity_ownership": "Gear identity primitives + shared product workspace contract; Portal excluded (ADR 0028)",
  "stack_matrix": {
    "go": [
      "Rust service: Tokio, Axum, SQLx-ready, tracing (ids-only)",
      "Dioxus 0.7.9 across web/PWA, SSR/SSG, fullstack, desktop, Android and iOS; support is claimed per target only after Wrench evidence",
      "DB security gate whenever PostgreSQL is used (libre-ai/wrench/db-inspect)"
    ],
    "conditional_go": [
      "PostgreSQL + SQLx - only when durable persistence is required",
      "OIDC/Keycloak + Biscuit - only for organizational or multi-tenant rights",
      "Clever Cloud/SQL/Cellar and Clever AI through portable adapters after operational approval (ADR 0043)"
    ],
    "spike_local": [
      "RAG / pgvector beyond fixture-level proofs",
      "Dioxus desktop/mobile target evidence until each OS passes its Wrench matrix",
      "document worker: isolated, networkless, strict advisory gate"
    ],
    "wait": [
      "Redis / persisted queues - until a product slice proves fanout/retry durability",
      "Duplicate SwiftUI/Compose product UIs - escape hatch only after explicit product evidence"
    ],
    "no_go": [
      "Paid provisioning or live providers without a separate human operation approval",
      "Direct model-provider fallback or provider SDK in core truth",
      "Mandatory US-hyperscaler or proprietary SaaS dependencies in core truth"
    ],
    "narrowed": [
      "Astro static publication: permitted outside ecosystem products only; ecosystem products publish via Dioxus SSG (ADR 0032 s3)"
    ]
  },
  "dod_chain": [
    "libre-ai/portal (tokens/primitives consumed)",
    "libre-ai/gear/context/loader (canonical ingestion)",
    "libre-ai/gear/context/memory (source refs/provenance)",
    "libre-ai/gear/supply/depot (ArtifactRef/Manifest export)",
    "libre-ai/gear/supply/cable (packaging when needed)",
    "libre-ai/wrench evidence (+ db-inspect for SQL)",
    "libre-ai/bolt planning-only handoff with evidence refs",
    "product explanation/publication"
  ],
  "flagship_slice": "libre-ai/sessions",
  "wave": {
    "name": "2026-07 clean-room capability wave",
    "posture": "big-bang: nothing is in service, blocking is acceptable, per-repo gates stay green at every merge",
    "reference": "ADR 0038–0044 and ecosystem target-version.md"
  },
  "language_ownership": {
    "durable_core": "rust",
    "web_shell": "dioxus-0.7.9",
    "typescript_allowlist": [
      "browser-presentation",
      "playwright",
      "generated-client",
      "office-host",
      "bounded-tooling"
    ],
    "forbidden_source_extensions": [
      ".js",
      ".jsx",
      ".mjs",
      ".cjs"
    ]
  },
  "clean_room": {
    "required": true,
    "fixtures": "synthetic-only",
    "forbidden": [
      "source-copy",
      "transliteration",
      "private-prompts",
      "private-schemas",
      "private-corpus"
    ]
  },
  "specialized_adapters": [
    {
      "class": "document-parser",
      "owner": "libre-ai/gear/context/loader",
      "isolation": "process",
      "fail_closed": true,
      "adr": "ADR 0038"
    },
    {
      "class": "office-host",
      "owner": "product-local",
      "isolation": "browser-host",
      "fail_closed": true,
      "adr": "ADR 0039"
    },
    {
      "class": "hosted-ai",
      "owner": "product-local",
      "isolation": "provider-port",
      "fail_closed": true,
      "adr": "ADR 0043"
    }
  ],
  "authorization": {
    "delegation": "biscuit",
    "signature": "ed25519",
    "tenant_fact": "organization",
    "vocabulary": [
      "organization",
      "workspace",
      "actor",
      "resource",
      "action",
      "purpose",
      "delegation_id",
      "revocation_ref"
    ],
    "adr": "ADR 0041"
  },
  "infrastructure": {
    "compute": "Clever Cloud",
    "sql": "Clever PostgreSQL",
    "object_storage": "Cellar via provider-neutral S3 port",
    "hosted_ai": "Clever AI via provider-neutral port",
    "forge": "GitHub canonical public forge",
    "direct_model_providers": "blocked; no implicit fallback",
    "portability_adr": "ADR 0043"
  },
  "panic_policy": {
    "server": "unwind",
    "supervisor": "unwind",
    "hostile_parser": "separate killable process",
    "cli": "abort only after local measurement",
    "wasm": "abort only after local measurement",
    "adr": "ADR 0044"
  },
  "compromises": [
    {
      "id": "CMP-GITHUB",
      "subject": "canonical public forge and distribution",
      "adr": "ADR 0043"
    },
    {
      "id": "CMP-CLEVER",
      "subject": "named EU hosted compute, SQL, object storage and AI boundaries",
      "adr": "ADR 0043"
    },
    {
      "id": "CMP-ADAPTERS",
      "subject": "bounded specialized runtimes outside the Rust core",
      "adr": "ADR 0038"
    }
  ]
}
